,number,value,datetime_start,datetime_complete,duration,params_act_fun,params_exponent_n_steps,params_gamma,params_lr,params_max_grad_norm,params_net_arch,user_attrs_gamma_,user_attrs_n_steps,state
0,0,64.9,2025-05-12 11:01:35.754883,2025-05-12 11:02:05.314462,0 days 00:00:29.559579,relu,3,0.06235311831678786,5.22225490441853e-05,4.990617885002144,tiny,0.9376468816832122,8,COMPLETE
1,1,90.0,2025-05-12 11:02:05.316166,2025-05-12 11:02:26.219866,0 days 00:00:20.903700,relu,6,0.008164065165278631,4.669684463418333e-05,1.1338646849151148,tiny,0.9918359348347213,64,COMPLETE
2,2,9.8,2025-05-12 11:02:26.222767,2025-05-12 11:02:44.797751,0 days 00:00:18.574984,relu,6,0.05529054689811549,0.2760651598406869,2.3467340304142934,tiny,0.9447094531018845,64,COMPLETE
3,3,98.3,2025-05-12 11:02:44.799951,2025-05-12 11:03:03.181746,0 days 00:00:18.381795,tanh,8,0.005729047237812653,2.430154759345425e-05,3.933092079588516,tiny,0.9942709527621874,256,COMPLETE
4,4,9.4,2025-05-12 11:03:03.183493,2025-05-12 11:03:28.550273,0 days 00:00:25.366780,relu,4,0.0028624680670037515,0.02352768963708196,1.7675956058929994,small,0.9971375319329963,16,COMPLETE
5,5,330.5,2025-05-12 11:03:28.552092,2025-05-12 11:03:48.709509,0 days 00:00:20.157417,tanh,10,0.00010694809046374405,0.0010862758536569126,0.34249208504594053,small,0.9998930519095363,1024,COMPLETE
6,6,328.9,2025-05-12 11:03:48.713739,2025-05-12 11:04:09.123911,0 days 00:00:20.410172,tanh,10,0.000107604061550901,0.0009534286197241654,0.3137642454488458,small,0.9998923959384491,1024,COMPLETE
7,7,298.7,2025-05-12 11:04:09.126187,2025-05-12 11:04:28.951323,0 days 00:00:19.825136,tanh,10,0.00010279993215949562,0.001789505797227902,0.35823552369324557,small,0.9998972000678406,1024,COMPLETE
8,8,9.5,2025-05-12 11:04:28.953487,2025-05-12 11:04:38.649050,0 days 00:00:09.695563,tanh,8,0.0005752032788591868,0.018653187232040753,0.6796868436336693,small,0.9994247967211408,256,PRUNED
9,9,500.0,2025-05-12 11:04:38.650438,2025-05-12 11:04:58.270433,0 days 00:00:19.619995,tanh,8,0.0006461886307566051,0.0004001535297987621,0.6362934518254555,small,0.9993538113692434,256,COMPLETE
10,10,192.4,2025-05-12 11:04:58.272920,2025-05-12 11:05:19.774447,0 days 00:00:21.501527,tanh,8,0.0008111427936239372,0.0002680611579131987,0.6903496494366022,small,0.9991888572063761,256,COMPLETE
11,11,117.4,2025-05-12 11:05:19.776114,2025-05-12 11:05:30.495813,0 days 00:00:10.719699,tanh,9,0.0004356685430177584,0.0003916819737204068,0.5651763910358436,small,0.9995643314569822,512,PRUNED
12,12,356.5,2025-05-12 11:05:30.497272,2025-05-12 11:05:55.784970,0 days 00:00:25.287698,tanh,7,0.0002960438771732889,0.008870352405352224,0.47993400721179597,small,0.9997039561228267,128,COMPLETE
13,13,8.6,2025-05-12 11:05:55.787811,2025-05-12 11:06:06.620539,0 days 00:00:10.832728,tanh,7,0.001357820240084912,0.014143746496786543,1.0773621579750028,small,0.9986421797599151,128,PRUNED
14,14,9.5,2025-05-12 11:06:06.622684,2025-05-12 11:06:18.018698,0 days 00:00:11.396014,tanh,5,0.0002789923399594709,0.2408953606120386,0.5327172444478843,small,0.9997210076600406,32,PRUNED
15,15,237.8,2025-05-12 11:06:18.020258,2025-05-12 11:06:38.200064,0 days 00:00:20.179806,tanh,7,0.0016205644794222733,0.007472094459977341,0.9127153429156465,small,0.9983794355205777,128,COMPLETE
16,16,9.4,2025-05-12 11:06:38.202850,2025-05-12 11:06:48.787141,0 days 00:00:10.584291,tanh,5,0.00023925988657907206,0.07514422617923551,1.7635636251496447,small,0.999760740113421,32,PRUNED
17,17,104.2,2025-05-12 11:06:48.789313,2025-05-12 11:06:58.218173,0 days 00:00:09.428860,tanh,9,0.024799331057228396,0.0002270745164237713,0.4567317056226239,small,0.9752006689427716,512,PRUNED
18,18,500.0,2025-05-12 11:06:58.219607,2025-05-12 11:07:17.353571,0 days 00:00:19.133964,relu,7,0.0011042142200404944,0.004468531809159811,0.8046073563111502,tiny,0.9988957857799595,128,COMPLETE
19,19,500.0,2025-05-12 11:07:17.355715,2025-05-12 11:07:36.189043,0 days 00:00:18.833328,relu,9,0.003294036708704893,0.003837013631697272,0.8227196959298381,tiny,0.9967059632912951,512,COMPLETE
20,20,76.6,2025-05-12 11:07:36.191074,2025-05-12 11:07:45.956582,0 days 00:00:09.765508,relu,5,0.0013470779727474745,0.0001013653612458249,1.4917189823531425,tiny,0.9986529220272525,32,PRUNED
21,21,475.3,2025-05-12 11:07:45.958012,2025-05-12 11:08:05.325352,0 days 00:00:19.367340,relu,9,0.004206984384711317,0.0038702328112428072,0.8181394464302211,tiny,0.9957930156152887,512,COMPLETE
22,22,328.9,2025-05-12 11:08:05.328258,2025-05-12 11:08:23.941942,0 days 00:00:18.613684,relu,8,0.013993435746932298,0.0032379370162212745,0.8455423504910884,tiny,0.9860065642530677,256,COMPLETE
23,23,92.7,2025-05-12 11:08:23.944786,2025-05-12 11:08:41.993246,0 days 00:00:18.048460,relu,9,0.0021499321838896793,0.05019928148383417,0.6982189135634249,tiny,0.9978500678161103,512,COMPLETE
24,24,95.3,2025-05-12 11:08:41.995585,2025-05-12 11:08:51.001666,0 days 00:00:09.006081,relu,7,0.0007912820513343718,0.0007763925564936451,1.181538422390895,tiny,0.9992087179486656,128,PRUNED
25,25,75.2,2025-05-12 11:08:51.004355,2025-05-12 11:08:59.769590,0 days 00:00:08.765235,relu,8,0.009377986621425213,1.2022050079275983e-05,0.41866741767396887,tiny,0.9906220133785748,256,PRUNED
26,26,500.0,2025-05-12 11:08:59.771399,2025-05-12 11:09:19.768027,0 days 00:00:19.996628,relu,6,0.002808747189125531,0.003585421311465121,0.603042357616119,tiny,0.9971912528108745,64,COMPLETE
27,27,9.3,2025-05-12 11:09:19.770482,2025-05-12 11:09:28.407686,0 days 00:00:08.637204,relu,9,0.0009302597058136017,0.6798394140475128,0.9576916036188653,tiny,0.9990697402941864,512,PRUNED
28,28,488.3,2025-05-12 11:09:28.409040,2025-05-12 11:09:46.800022,0 days 00:00:18.390982,relu,8,0.003972684425608822,0.0019637053674304455,1.303028125047762,tiny,0.9960273155743912,256,COMPLETE
29,29,83.6,2025-05-12 11:09:46.803218,2025-05-12 11:09:59.954402,0 days 00:00:13.151184,relu,3,0.0005138260081633884,0.00012322548431886957,2.3279596067008153,tiny,0.9994861739918366,8,PRUNED
30,30,104.7,2025-05-12 11:09:59.957278,2025-05-12 11:10:09.332185,0 days 00:00:09.374907,relu,7,0.09820647681551131,0.0005473953163415233,0.7648606028126597,tiny,0.9017935231844887,128,PRUNED
31,31,207.6,2025-05-12 11:10:09.333812,2025-05-12 11:10:28.921647,0 days 00:00:19.587835,relu,6,0.0022733002476537987,0.005168714474573409,0.5932882864371514,tiny,0.9977266997523462,64,COMPLETE
32,32,427.0,2025-05-12 11:10:28.923393,2025-05-12 11:10:48.368723,0 days 00:00:19.445330,relu,6,0.005867020250929529,0.001954872356634644,0.6090380088359052,tiny,0.9941329797490704,64,COMPLETE
33,33,9.5,2025-05-12 11:10:48.373835,2025-05-12 11:10:58.196608,0 days 00:00:09.822773,relu,6,0.0011801398266155464,0.03848052774973169,0.9920615933626264,tiny,0.9988198601733844,64,PRUNED
34,34,171.7,2025-05-12 11:10:58.198148,2025-05-12 11:11:18.411269,0 days 00:00:20.213121,relu,6,0.002680616317637904,0.00846714414070638,0.43076544255777877,tiny,0.9973193836823621,64,PRUNED
35,35,121.0,2025-05-12 11:11:18.414192,2025-05-12 11:11:27.513319,0 days 00:00:09.099127,relu,7,0.010330714464149512,5.578658410073714e-05,0.512768867129485,tiny,0.9896692855358505,128,PRUNED
36,36,456.5,2025-05-12 11:11:27.515234,2025-05-12 11:11:48.394031,0 days 00:00:20.878797,relu,5,0.01833523016208286,0.0015431708263527568,1.4228909671798522,tiny,0.9816647698379172,32,COMPLETE
37,37,89.8,2025-05-12 11:11:48.395523,2025-05-12 11:11:59.320314,0 days 00:00:10.924791,relu,4,0.005209656690270128,0.003851314284442969,0.7669686287040329,tiny,0.9947903433097298,16,PRUNED
38,38,121.3,2025-05-12 11:11:59.322342,2025-05-12 11:12:08.324207,0 days 00:00:09.001865,relu,10,0.001913282013116137,0.0005911504977389654,0.3733581770434292,tiny,0.9980867179868839,1024,PRUNED
39,39,9.0,2025-05-12 11:12:08.325595,2025-05-12 11:12:16.990561,0 days 00:00:08.664966,relu,8,0.0032606737506823986,0.13182124669942394,0.6459793003760625,tiny,0.9967393262493176,256,PRUNED
40,40,500.0,2025-05-12 11:12:16.992263,2025-05-12 11:12:36.700325,0 days 00:00:19.708062,relu,9,0.00042807226208979387,0.013648244278226508,1.084970573366052,tiny,0.9995719277379103,512,COMPLETE
41,41,192.7,2025-05-12 11:12:36.702528,2025-05-12 11:12:45.737813,0 days 00:00:09.035285,relu,9,0.00016528850620514056,0.015383122750893749,1.056698072795211,tiny,0.9998347114937949,512,PRUNED
42,42,151.1,2025-05-12 11:12:45.739664,2025-05-12 11:12:54.856002,0 days 00:00:09.116338,relu,10,0.0006328874010630053,0.024735818118069155,0.8946038757814984,tiny,0.999367112598937,1024,PRUNED
43,43,500.0,2025-05-12 11:12:54.857879,2025-05-12 11:13:15.532650,0 days 00:00:20.674771,relu,8,0.00037706700893642715,0.005477755787003727,0.7308304789143238,tiny,0.9996229329910635,256,COMPLETE
44,44,485.0,2025-05-12 11:13:15.534863,2025-05-12 11:13:35.008497,0 days 00:00:19.473634,tanh,9,0.0010404225884508883,0.0022842357382960175,1.1588218006744921,tiny,0.9989595774115491,512,COMPLETE
45,45,494.2,2025-05-12 11:13:35.010880,2025-05-12 11:13:58.106357,0 days 00:00:23.095477,relu,8,0.0006842117839962359,0.0011676085540429251,2.8760125625287287,small,0.9993157882160038,256,COMPLETE
46,46,35.6,2025-05-12 11:13:58.109198,2025-05-12 11:14:07.957979,0 days 00:00:09.848781,tanh,7,0.00021764516111782707,0.009954918657753645,4.485289545391291,small,0.9997823548388822,128,PRUNED
47,47,185.8,2025-05-12 11:14:07.959310,2025-05-12 11:14:16.824196,0 days 00:00:08.864886,relu,10,0.0003450155998115142,0.02229804272974702,0.6222856825454623,tiny,0.9996549844001885,1024,PRUNED
48,48,123.2,2025-05-12 11:14:16.826824,2025-05-12 11:14:26.373381,0 days 00:00:09.546557,tanh,9,0.0001528453208485612,0.00024476291445506206,1.7010794436752816,small,0.9998471546791514,512,PRUNED
49,49,9.4,2025-05-12 11:14:26.375140,2025-05-12 11:14:36.634396,0 days 00:00:10.259256,tanh,8,0.00136208415541385,0.012487163048576368,0.5329944240853934,small,0.9986379158445862,256,PRUNED
50,50,500.0,2025-05-12 11:14:36.636610,2025-05-12 11:14:57.432295,0 days 00:00:20.795685,relu,7,0.0004807039487577529,0.006058341664116479,1.2698947525927438,tiny,0.9995192960512422,128,COMPLETE
51,51,59.2,2025-05-12 11:14:57.434489,2025-05-12 11:15:07.553944,0 days 00:00:10.119455,relu,8,0.0003978689354440313,0.004745566388873478,0.7095869576148299,tiny,0.999602131064556,256,PRUNED
52,52,464.0,2025-05-12 11:15:07.556755,2025-05-12 11:15:30.144532,0 days 00:00:22.587777,relu,8,0.006581127817864176,0.0024383029601331534,0.7746572644787958,tiny,0.9934188721821359,256,COMPLETE
53,53,122.1,2025-05-12 11:15:30.146677,2025-05-12 11:15:41.000951,0 days 00:00:10.854274,relu,9,0.00178581622964873,0.0013220562071274155,0.8752406431818233,tiny,0.9982141837703513,512,PRUNED
54,54,214.1,2025-05-12 11:15:41.003745,2025-05-12 11:15:51.076758,0 days 00:00:10.073013,relu,8,0.0008094838210289871,0.006445085653200312,1.0244059775409233,tiny,0.999190516178971,256,PRUNED
55,55,54.1,2025-05-12 11:15:51.078956,2025-05-12 11:16:00.980195,0 days 00:00:09.901239,tanh,7,0.00036363195403420326,0.03277211105930741,0.697103704385546,tiny,0.9996363680459658,128,PRUNED
56,56,483.8,2025-05-12 11:16:00.982346,2025-05-12 11:16:24.952255,0 days 00:00:23.969909,relu,9,0.0002004290543828893,0.003044633934450725,0.4728713753349205,small,0.9997995709456171,512,COMPLETE
57,57,9.1,2025-05-12 11:16:24.955131,2025-05-12 11:16:35.200201,0 days 00:00:10.245070,relu,10,0.0033205928531457748,0.0664447248705819,0.3040206954682037,tiny,0.9966794071468542,1024,PRUNED
58,58,219.2,2025-05-12 11:16:35.202168,2025-05-12 11:16:58.400553,0 days 00:00:23.198385,tanh,6,0.0006602387612830787,0.000929133377248198,0.7940810756088721,small,0.9993397612387169,64,PRUNED
